{
  "id": 1,
  "tenantId": null,
  "groups": [
    "group2",
    "group3"
  ],
  "description": "Lorem ipsum",
  "slug": "consultingtype1",
  "consultantBoundedToConsultingType": false,
  "sendSaveSessionDataMessage": true,
  "isVideoCallAllowed": false,
  "languageFormal": true,
  "roles": {
    "consultant": {
      "defaultRole": [
        "consultant"
      ]
    }
  },
  "registration": {
    "mandatoryFields": {
      "age": false,
      "state": false
    },
    "notes": {

    }
  },
  "urls": {
  } ,
  "isSubsequentRegistrationAllowed": false
}
