{
  "id": 0,
  "tenantId": null,
  "groups": [
    "group1"
  ],
  "description": "Lorem ipsum",
  "furtherInformation": {
    "label": "Lorem Impsum",
    "url": "https://www.domain.com"
  },
  "slug": "consultingtype0",
  "excludeNonMainConsultantsFromTeamSessions": false,
  "consultantBoundedToConsultingType": false,
  "isSubsequentRegistrationAllowed": true,
  "showAskerProfile": false,
  "isVideoCallAllowed": false,
  "welcomeMessage": {
    "sendWelcomeMessage": true,
    "welcomeMessageText": "Lorem ipsum"
  },
  "sendFurtherStepsMessage": true,
  "sessionDataInitializing": {
    "addictiveDrugs": true,
    "age": true,
    "gender": true,
    "relation": true,
    "state": true
  },
  "whiteSpot": {
    "whiteSpotAgencyAssigned": true,
    "whiteSpotAgencyId": 100
  },
  "groupChat": {
    "isGroupChat": true,
    "groupChatRules": [
      "Lorem ipsum",
      "Lorem ipsum"
    ]
  },
  "languageFormal": true,
  "roles": {
    "consultant": {
      "main": [
        "consultant",
        "u25-consultant",
        "u25-main-consultant"
      ],
      "peer": [
        "consultant",
        "u25-consultant"
      ]
    }
  },
  "notifications": {
    "teamSessions": {
      "newMessage": {
        "allTeamConsultants": false
      }
    }
  },
  "registration": {
    "minPostcodeSize": 3,
    "autoSelectAgency": true,
    "autoSelectPostcode": true,
    "mandatoryFields": {
      "age": false,
      "state": false
    },
    "notes": {
      "agencySelection": "Lorem ipsum",
      "password": "Dolor sit amet"
    }
  },
  "urls": {
    "requiredAidMissingRedirectUrl": "https://www.domain.tld/requiredAidMissingRedirectPath",
    "registrationPostcodeFallbackUrl": "https://www.domain.tld/registrationPostcodeFallbackPath"
  },
  "requiredComponents": {
    "age": {
      "isEnabled": true,
      "options": [
        {
          "value": "50",
          "label": "20"
        },
        {
          "value": "51",
          "label": "21"
        },
        {
          "value": "52",
          "label": "22"
        },
        {
          "value": "53",
          "label": "23"
        },
        {
          "value": "54",
          "label": "24"
        },
        {
          "value": "55",
          "label": "25"
        },
        {
          "value": "56",
          "label": "26"
        }
      ]
    },
    "state": {
      "isEnabled": true
    }
  }
}
